{
  "valid": true,
  "checked": 2,
  "tableRows": 3,
  "brokenIndex": null,
  "tableIds": { "min": 90210, "max": 90212, "count": 3, "digest": "432269c98df04544" },
  "verifiedIds": { "min": 90210, "max": 90211, "count": 2, "digest": "8b23b93a16760cdb" },
  "unverifiedIds": {
    "min": 90212,
    "max": 90212,
    "count": 1,
    "digest": "9659d12b5246cd7c",
    "ids": [90212],
    "truncated": false
  },
  "chain": [
    {
      "id": 90210,
      "createdAt": "2026-09-11T09:11:02.000Z",
      "action": "chat",
      "toolName": null,
      "prevHash": null,
      "hash": "aabbccddeeff00112233445566778899aabbccddeeff00112233445566778899",
      "isError": false,
      "broken": false
    },
    {
      "id": 90211,
      "createdAt": "2026-09-11T09:12:55.000Z",
      "action": "tool_call",
      "toolName": "create_followup_task",
      "prevHash": "aabbccddeeff00112233445566778899aabbccddeeff00112233445566778899",
      "hash": "11223344556677889900aabbccddeeff11223344556677889900aabbccddeeff",
      "isError": false,
      "broken": false
    }
  ]
}
